Rank,Movie_name,URL,Release_Year,IMDB_Rating,Reviewer_count,Censor_Board_Rating,Movie_Length,Release_Date,Genre,Story_Summary,Director,Writers,Stars,Plot_Keywords,Budget,Gross_USA,Cum_Worldwide_Gross,Production_Company
173,Fargo,https://www.imdb.com/title/tt0116282/,1996,8.1,586467,R,1h 38min,5 April 1996 (USA),"['Crime', 'Drama', 'Thriller']",Jerry Lundegaard's inept crime falls apart due to his and his henchmen's bungling and the persistent police work of the quite pregnant Marge Gunderson.,Joel Coen,"['Ethan Coen', 'Joel Coen']","['William H. Macy', 'Frances McDormand', 'Steve Buscemi']","['black comedy', 'neo noir', 'americana', 'original story', 'fargo north dakota']","$7,000,000(estimated)","$24,611,975","$60,611,975","PolyGram Filmed Entertainment,Working Title Films"
174,Kill Bill: Vol. 1,https://www.imdb.com/title/tt0266697/,2003,8.1,953510,R,1h 51min,10 October 2003 (USA),"['Action', 'Crime', 'Thriller']","After awakening from a four-year coma, a former assassin wreaks vengeance on the team of assassins who betrayed her.",Quentin Tarantino,"['Quentin Tarantino', 'Quentin Tarantino(character The Bride) (as Q)']","['Uma Thurman', 'David Carradine', 'Daryl Hannah']","['revenge', 'bride', 'sword', 'female protagonist', 'martial arts']","$30,000,000(estimated)","$70,099,045","$180,899,045","Miramax,A Band Apart,Super Cool ManChu"
175,Gran Torino,https://www.imdb.com/title/tt1205489/,2008,8.1,693717,R,1h 56min,9 January 2009 (USA),['Drama'],"Disgruntled Korean War veteran Walt Kowalski sets out to reform his neighbor, Thao Lor, a Hmong teenager who tried to steal Kowalski's prized possession: a 1972 Gran Torino.",Clint Eastwood,"['Nick Schenk(screenplay)', 'Dave Johannson(story)']","['Clint Eastwood', 'Bee Vang', 'Christopher Carley']","['gang', 'widower', 'gang rape', 'teenager', 'street gang']","$33,000,000(estimated)","$148,095,302","$269,958,228","Matten Productions,Double Nickel Entertainment,Gerber Pictures"
176,Stalker,https://www.imdb.com/title/tt0079944/,1979,8.2,106131,Not Rated,2h 42min,17 April 1980 (Netherlands),"['Drama', 'Sci-Fi']",A guide leads two men through an area known as the Zone to find a room that grants wishes.,Andrei Tarkovsky,"['Arkadiy Strugatskiy(novel)', 'Boris Strugatskiy(novel)', '2 more credits»']","['Alisa Freyndlikh', 'Aleksandr Kaydanovskiy', 'Anatoliy Solonitsyn']","['guide', 'writer', 'professor', 'ringing phone', 'phone ringing']","RUR6,000,000(estimated)","$292,049","$303,806","Mosfilm,Vtoroe Tvorcheskoe Obedinenie"
177,The Truman Show,https://www.imdb.com/title/tt0120382/,1998,8.1,881713,PG,1h 43min,5 June 1998 (USA),"['Comedy', 'Drama', 'Sci-Fi']",An insurance salesman discovers his whole life is actually a reality TV show.,Peter Weir,['Andrew Niccol'],"['Jim Carrey', 'Ed Harris', 'Laura Linney']","['hidden camera', 'simulated reality', 'fictional reality show', 'controlled environment', 'deception']","$60,000,000(estimated)","$125,618,201","$264,118,201","Paramount Pictures,Scott Rudin Productions"
178,The Deer Hunter,https://www.imdb.com/title/tt0077416/,1978,8.1,296733,R,3h 3min,23 February 1979 (USA),"['Drama', 'War']",An in-depth examination of the ways in which the U.S. Vietnam War impacts and disrupts the lives of people in a small industrial town in Pennsylvania.,Michael Cimino,"['Michael Cimino(story)', 'Deric Washburn(story)', '3 more credits»']","['Robert De Niro', 'Christopher Walken', 'John Cazale']","['american imperialism', 'vietnam war veteran', 'psychic', 'disorder', 'mental health']","$15,000,000(estimated)","$48,979,328","$49,074,243","EMI Films,Universal Pictures"
179,Tokyo Story,https://www.imdb.com/title/tt0046438/,1953,8.2,47520,Not Rated,2h 16min,13 March 1972 (USA),['Drama'],"An old couple visit their children and grandchildren in the city, but receive little attention.",Yasujirô Ozu,"['Kôgo Noda(scenario)', 'Yasujirô Ozu(scenario)']","['Chishû Ryû', 'Chieko Higashiyama', 'Sô Yamamura']","['estrangement', 'family reunion', 'post world war two', 'japanese', 'generation gap']",,,"$40,405",Shochiku
180,Memories of Murder,https://www.imdb.com/title/tt0353969/,2003,8.1,118018,Not Rated,2h 12min,2 May 2003 (South Korea),"['Action', 'Crime', 'Drama']","In a small Korean province in 1986, two detectives struggle with the case of multiple young women being found raped and murdered by an unknown culprit.",Bong Joon Ho,"['Bong Joon Ho', 'Kwang-rim Kim(play)']","['Kang-ho Song', 'Sang-kyung Kim', 'Roe-ha Kim']","['serial killer', 'based on true story', 'false evidence', 'police violence', 'violence']","$2,800,000(estimated)","$15,357","$927,398","CJ Entertainment,Muhan Investment,Sidus"
181,Relatos salvajes,https://www.imdb.com/title/tt3011894/,2014,8.1,162506,R,2h 2min,21 August 2014 (Argentina),"['Comedy', 'Drama', 'Thriller']",Six short stories that explore the extremities of human behavior involving people in distress.,Damián Szifron,"['Germán Servidio(collaborating writer)', 'Damián Szifron']","['Darío Grandinetti', 'María Marull', 'Mónica Villa']","['suicide by airplane crash', 'anthology film', 'revenge', 'wedding party', 'music critic']","$3,300,000(estimated)","$3,106,530","$30,642,704","British Film Institute (BFI),Canal+,Corner Producciones"
182,The Bandit,https://www.imdb.com/title/tt0116231/,1996,8.3,59277,TV-MA,2h 8min,29 November 1996 (Turkey),"['Crime', 'Drama', 'Thriller']","Baran the Bandit, released from prison after 35 years, searches for vengeance and his lover.",Yavuz Turgul,['Yavuz Turgul'],"['Sener Sen', 'Ugur Yücel', 'Sermin Hürmeriç']","['bandit', 'money', 'prison', 'bar', 'mafia']","TRL1,200,000(estimated)",,,"Artcam International,Filma-Cass,Geopoly"
183,The Big Lebowski,https://www.imdb.com/title/tt0118715/,1998,8.1,693777,R,1h 57min,6 March 1998 (USA),"['Comedy', 'Crime', 'Sport']","Jeff ""The Dude"" Lebowski, mistaken for a millionaire of the same name, seeks restitution for his ruined rug and enlists his bowling buddies to help get it.",Joel Coen,"['Ethan Coen', 'Joel Coen']","['Jeff Bridges', 'John Goodman', 'Julianne Moore']","['rug', 'nihilism', 'pornographer', 'white russian', 'bowling alley']","$15,000,000(estimated)","$18,034,458","$46,735,469","Polygram Filmed Entertainment,Working Title Films"
184,Andhadhun,https://www.imdb.com/title/tt8108198/,2018,8.3,57763,Not Rated,2h 19min,5 October 2018 (USA),"['Crime', 'Thriller']","A series of mysterious events changes the life of a blind pianist, who must now report a crime that he should technically know nothing of.",Sriram Raghavan,"['Arijit Biswas', 'Yogesh Chandekar', '4 more credits»']","['Ayushmann Khurrana', 'Tabu', 'Radhika Apte']","['blind', 'neo noir', 'pianist', 'murder', 'blackmail']","$4,500,000(estimated)","$1,193,046","$49,391,206","Matchbox Pictures,Viacom18 Motion Pictures"
185,Mary and Max,https://www.imdb.com/title/tt0978762/,2009,8.1,157187,Not Rated,1h 32min,9 April 2009 (Australia),"['Animation', 'Comedy', 'Drama']","A tale of friendship between two unlikely pen pals: Mary, a lonely, eight-year-old girl living in the suburbs of Melbourne, and Max, a forty-four-year old, severely obese man living in New York.",Adam Elliot,['Adam Elliot'],"['Toni Collette', 'Philip Seymour Hoffman', 'Eric Bana']","['stop motion', 'black comedy', 'male nudity', 'male frontal nudity', 'male full frontal nudity']","AUD8,240,000(estimated)",,"$1,739,445",Melodrama Pictures
186,Klaus,https://www.imdb.com/title/tt4729430/,2019,8.2,63135,PG,1h 36min,15 November 2019 (USA),"['Animation', 'Adventure', 'Comedy']","A simple act of kindness always sparks another, even in a frozen, faraway place. When Smeerensburg's new postman, Jesper, befriends toymaker Klaus, their gifts melt an age-old feud and deliver a sleigh full of holiday traditions.",Sergio Pablos,"['Sergio Pablos(original story by)', 'Sergio Pablos(screenplay by)', '2 more credits»']","['Jason Schwartzman', 'J.K. Simmons', 'Rashida Jones']","['christmas', 'friendship', 'post man', 'island', 'forest']","$40,000,000(estimated)",,,"The SPA Studios,Aniventure,Atresmedia Cine"
187,In the Name of the Father,https://www.imdb.com/title/tt0107207/,1993,8.1,148111,R,2h 13min,25 February 1994 (USA),"['Biography', 'Drama']",A man's coerced confession to an I.R.A. bombing he did not commit results in the imprisonment of his father as well. An English lawyer fights to free them.,Jim Sheridan,"['Gerry Conlon(autobiographical book ""Proved Innocent"")', 'Terry George(screenplay)']","['Daniel Day-Lewis', 'Pete Postlethwaite', 'Alison Crosbie']","['prison', 'father son relationship', 'based on true story', 'anti irish bias', 'psychological manipulation']","$13,000,000(estimated)","$25,096,862","$65,796,862","Hell's Kitchen Films,Universal Pictures"
188,Gone Girl,https://www.imdb.com/title/tt2267998/,2014,8.1,806085,R,2h 29min,3 October 2014 (USA),"['Drama', 'Mystery', 'Thriller']","With his wife's disappearance having become the focus of an intense media circus, a man sees the spotlight turned on him when it's suspected that he may not be innocent.",David Fincher,"['Gillian Flynn(screenplay)', 'Gillian Flynn(novel)']","['Ben Affleck', 'Rosamund Pike', 'Neil Patrick Harris']","['disappearance', 'missing person', 'murder suspect', 'husband wife relationship', 'based on novel']","$61,000,000(estimated)","$167,767,189","$369,330,363","Twentieth Century Fox,Regency Enterprises,TSG Entertainment"
189,Hacksaw Ridge,https://www.imdb.com/title/tt2119532/,2016,8.1,399915,R,2h 19min,4 November 2016 (USA),"['Biography', 'Drama', 'History']","World War II American Army MedicDesmond T. Doss, who served during the Battle of Okinawa, refuses to kill people, and becomes the first man in American history to receive the Medal of Honor without firing a shot.",Mel Gibson,"['Robert Schenkkan(screenplay by)', 'Andrew Knight(screenplay by)']","['Andrew Garfield', 'Sam Worthington', 'Luke Bracey']","['world war two', 'conscientious objector', 'soldier', 'medic', '1940s']","$40,000,000(estimated)","$67,209,615","$180,450,918","Summit Entertainment,Demarest Films,Pandemonium"
190,Ford v Ferrari,https://www.imdb.com/title/tt1950186/,2019,8.1,185320,PG-13,2h 32min,15 November 2019 (USA),"['Action', 'Biography', 'Drama']",American car designerCarroll Shelbyand driverKen Milesbattle corporate interference and the laws of physics to build a revolutionary race car for Ford in order to defeat Ferrari at the 24 Hours of Le Mans in 1966.,James Mangold,"['Jez Butterworth', 'John-Henry Butterworth']","['Matt Damon', 'Christian Bale', 'Jon Bernthal']","['based on true story', 'racecar', 'racecar driver', 'car racing', 'based on book']","$97,600,000(estimated)","$117,624,357","$225,508,210","Chernin Entertainment,Twentieth Century Fox"
191,The Grand Budapest Hotel,https://www.imdb.com/title/tt2278388/,2014,8.1,667548,R,1h 39min,28 March 2014 (USA),"['Adventure', 'Comedy', 'Crime']","A writer encounters the owner of an aging high-class hotel, who tells him of his early years serving as a lobby boy in the hotel's glorious years under an exceptional concierge.",Wes Anderson,"['Stefan Zweig(inspired by the writings of)', 'Wes Anderson(screenplay)', '2 more credits»']","['Ralph Fiennes', 'F. Murray Abraham', 'Mathieu Amalric']","['hotel', 'lobby boy', 'prison escape', 'first person narration', 'painting']","$25,000,000(estimated)","$59,301,324","$172,936,941","Fox Searchlight Pictures,Indian Paintbrush,Studio Babelsberg"
192,Mr. Smith Goes to Washington,https://www.imdb.com/title/tt0031679/,1939,8.1,102020,Not Rated,2h 9min,19 October 1939 (USA),"['Comedy', 'Drama']","A naive man is appointed to fill a vacancy in the United States Senate. His plans promptly collide with political corruption, but he doesn't back down.",Frank Capra,"['Sidney Buchman(screen play)', 'Lewis R. Foster(story)']","['James Stewart', 'Jean Arthur', 'Claude Rains']","['u.s. senator', 'national film registry', 'afi', 'children', 'butler']","$1,900,000(estimated)","$144,738","$144,738",Columbia Pictures
193,The General,https://www.imdb.com/title/tt0017925/,1926,8.1,75788,Passed,1h 7min,2 January 1927 (USA),"['Action', 'Adventure', 'Comedy']","When Union spies steal an engineer's beloved locomotive, he pursues it single-handedly and straight through enemy lines.",Clyde Bruckman,"['Buster Keaton', 'Clyde Bruckman', '2 more credits»']","['Buster Keaton', 'Marion Mack', 'Glen Cavender']","['train', 'national film registry', 'army', 'spy', 'confederate army']","$750,000(estimated)",,,"Buster Keaton Productions,Joseph M. Schenck Productions"
194,How to Train Your Dragon,https://www.imdb.com/title/tt0892769/,2010,8.1,637510,PG,1h 38min,26 March 2010 (USA),"['Animation', 'Action', 'Adventure']","A hapless young Viking who aspires to hunt dragons becomes the unlikely friend of a young dragon himself, and learns there may be more to the creatures than he assumed.",Dean DeBlois,"['William Davies(screenplay by) (as Will Davies)', 'Dean DeBlois(screenplay by)', '3 more credits»']","['Jay Baruchel', 'Gerard Butler', 'Christopher Mintz-Plasse']","['dragon', 'viking', 'village', 'island', 'training']","$165,000,000(estimated)","$217,581,231","$494,878,759","DreamWorks Animation,Mad Hatter Entertainment,Vertigo Entertainment"
195,Persona,https://www.imdb.com/title/tt0060827/,1966,8.1,93712,Not Rated,1h 23min,16 March 1967 (USA),"['Drama', 'Thriller']",A nurse is put in charge of a mute actress and finds that their personae are melding together.,Ingmar Bergman,['Ingmar Bergman(story and screenplay)'],"['Bibi Andersson', 'Liv Ullmann', 'Margaretha Krook']","['silence', 'patient', 'mute character', 'intercepted letter', 'sex on beach']",,,"$12,142","American International Pictures (AIP),Aurora,Svensk Filmindustri (SF)"
196,Sherlock Jr.,https://www.imdb.com/title/tt0015324/,1924,8.2,36920,Not Rated,45min,11 May 1924 (USA),"['Action', 'Comedy', 'Romance']","A film projectionist longs to be a detective, and puts his meagre skills to work when he is framed by a rival for stealing his girlfriend's father's pocketwatch.",Buster Keaton,"['Jean C. Havez(story) (as Jean Havez)', 'Joseph A. Mitchell(story) (as Joe Mitchell)']","['Buster Keaton', 'Kathryn McGuire', 'Joe Keaton']","['false accusation', 'surrealism', 'national film registry', 'character name as title', 'entering movie via screen']",,"$977,375",,Buster Keaton Productions
197,Before Sunrise,https://www.imdb.com/title/tt0112471/,1995,8.1,252167,R,1h 41min,27 January 1995 (USA),"['Drama', 'Romance']","A young man and woman meet on a train in Europe, and wind up spending one evening together in Vienna. Unfortunately, both know that this will probably be their only night together.",Richard Linklater,"['Richard Linklater', 'Kim Krizan']","['Ethan Hawke', 'Julie Delpy', 'Andrea Eckert']","['conversations', 'train', 'french', 'tourist', 'one night']","$2,500,000(estimated)","$5,535,405","$5,986,708","Castle Rock Entertainment,Detour Filmproduction,Filmhaus Wien Universa Filmproduktions"
198,Catch Me If You Can,https://www.imdb.com/title/tt0264464/,2002,8.1,770356,PG-13,2h 21min,25 December 2002 (USA),"['Biography', 'Crime', 'Drama']","A seasoned FBI agent pursuesFrank Abagnale Jr.who, before his 19th birthday, successfully forged millions of dollars' worth of checks while posing as a Pan Am pilot, a doctor, and a legal prosecutor.",Steven Spielberg,"['Jeff Nathanson(screenplay)', 'Frank Abagnale Jr.(book) (as Frank W. Abagnale)']","['Leonardo DiCaprio', 'Tom Hanks', 'Christopher Walken']","['scam artist', 'race against time', 'on the run', 'mother son relationship', 'reference to the new york yankees']","$52,000,000(estimated)","$164,615,351","$352,114,312","DreamWorks,Kemp Company,Splendid Pictures"
199,Prisoners,https://www.imdb.com/title/tt1392214/,2013,8.1,560176,R,2h 33min,20 September 2013 (USA),"['Crime', 'Drama', 'Mystery']","When Keller Dover's daughter and her friend go missing, he takes matters into his own hands as the police pursue multiple leads and the pressure mounts.",Denis Villeneuve,['Aaron Guzikowski'],"['Hugh Jackman', 'Jake Gyllenhaal', 'Viola Davis']","['child abduction', 'police', 'child kidnapping', 'vigilante justice', 'revenge']","$46,000,000(estimated)","$61,002,302","$122,126,687","Alcon Entertainment,8"
200,12 Years a Slave,https://www.imdb.com/title/tt2024544/,2013,8.1,607059,R,2h 14min,8 November 2013 (USA),"['Biography', 'Drama', 'History']","In the antebellum United States,Solomon Northup, a free black man from upstate New York, is abducted and sold into slavery.",Steve McQueen,"['John Ridley(screenplay by)', 'Solomon Northup(based on ""Twelve Years a Slave"" by)']","['Chiwetel Ejiofor', 'Michael Kenneth Williams', 'Michael Fassbender']","['torture', 'kidnapping', 'racism', 'whipping', 'slavery']","$20,000,000(estimated)","$56,671,993","$187,733,202","Regency Enterprises,River Road Entertainment,Plan B Entertainment"
201,Cool Hand Luke,https://www.imdb.com/title/tt0061512/,1967,8.1,154771,GP,2h 7min,1 November 1967 (USA),"['Crime', 'Drama']","A laid back Southern man is sentenced to two years in a rural prison, but refuses to conform.",Stuart Rosenberg,"['Donn Pearce(screenplay)', 'Frank Pierson(screenplay) (as Frank R. Pierson)']","['Paul Newman', 'George Kennedy', 'Strother Martin']","['prison', 'fugitive', 'bet', 'hard boiled egg', 'running away']","$3,200,000(estimated)",,,Jalem Productions
202,The Wages of Fear,https://www.imdb.com/title/tt0046268/,1953,8.1,50984,Not Rated,2h 11min,16 February 1955 (USA),"['Adventure', 'Drama', 'Thriller']","In a decrepit South American village, four men are hired to transport an urgent nitroglycerine shipment without the equipment that would make it safe.",Henri-Georges Clouzot,"['Georges Arnaud(novel)', 'Henri-Georges Clouzot(adaptation) (as H.G. Clouzot)']","['Yves Montand', 'Charles Vanel', 'Peter van Eyck']","['risk', 'nitroglycerin', 'oil', 'money', 'vibration']",,,"$1,098","Compagnie Industrielle et Commerciale Cinématographique (CICC),Filmsonor,Vera Films"
203,Mad Max: Fury Road,https://www.imdb.com/title/tt1392190/,2015,8.1,827543,R,2h,15 May 2015 (USA),"['Action', 'Adventure', 'Sci-Fi']","In a post-apocalyptic wasteland, a woman rebels against a tyrannical ruler in search for her homeland with the aid of a group of female prisoners, a psychotic worshiper, and a drifter named Max.",George Miller,"['George Miller', 'Brendan McCarthy']","['Tom Hardy', 'Charlize Theron', 'Nicholas Hoult']","['post apocalypse', 'desert', 'chase', 'car chase', 'escape']","$150,000,000(estimated)","$154,058,340","$375,209,362","Warner Bros.,Village Roadshow Pictures,Kennedy Miller Productions"
204,Stand by Me,https://www.imdb.com/title/tt0092005/,1986,8.1,347212,R,1h 29min,26 November 1986 (USA),"['Adventure', 'Drama']","After the death of one of his friends, a writer recounts a boyhood journey with his friends to find the body of a missing boy.",Rob Reiner,"['Stephen King(novel)', 'Raynold Gideon(screenplay)']","['Wil Wheaton', 'River Phoenix', 'Corey Feldman']","['friendship', 'childhood', 'walking on train tracks', 'summertime', 'treehouse']","$8,000,000(estimated)","$52,287,414","$52,287,414","Columbia Pictures,Act III,Act III Communications"
205,Network,https://www.imdb.com/title/tt0074958/,1976,8.1,137838,R,2h 1min,27 November 1976 (USA),['Drama'],A television network cynically exploits a deranged former anchor's ravings and revelations about the news media for its own profit.,Sidney Lumet,['Paddy Chayefsky'],"['Faye Dunaway', 'William Holden', 'Peter Finch']","['media', 'television', 'television network', 'satire', 'ranting']","$3,800,000(estimated)","$23,689,877","$23,690,757",Metro-Goldwyn-Mayer (MGM)
206,Into the Wild,https://www.imdb.com/title/tt0758758/,2007,8.1,545377,R,2h 28min,19 October 2007 (USA),"['Adventure', 'Biography', 'Drama']","After graduating from Emory University, top student and athlete Christopher McCandless abandons his possessions, gives his entire $24,000 savings account to charity and hitchhikes to Alaska to live in the wilderness. Along the way, Christopher encounters a series of characters that shape his life.",Sean Penn,"['Sean Penn(screenplay)', 'Jon Krakauer(book)']","['Emile Hirsch', 'Vince Vaughn', 'Catherine Keener']","['wilderness', 'alaska', 'journey', 'following a dream', 'self discovery']","$15,000,000(estimated)","$18,354,356","$56,674,477","Paramount Vantage,Art Linson Productions,Into the Wild"
207,Barry Lyndon,https://www.imdb.com/title/tt0072684/,1975,8.1,140070,PG,3h 5min,18 December 1975 (USA),"['Adventure', 'Drama', 'History']",An Irish rogue wins the heart of a rich widow and assumes her dead husband's aristocratic position in 18th-century England.,Stanley Kubrick,"['Stanley Kubrick(written for the screen by)', 'William Makepeace Thackeray(novel)']","[""Ryan O'Neal"", 'Marisa Berenson', 'Patrick Magee']","['rise and fall', 'highwayman', 'wealth', 'england', 'duel']","$11,000,000(estimated)",,"$198,992","Peregrine,Hawk Films,Warner Bros."
208,Monty Python's Life of Brian,https://www.imdb.com/title/tt0079470/,1979,8.1,350530,R,1h 34min,17 August 1979 (USA),['Comedy'],"Born on the original Christmas in the stable next door toJesus Christ, Brian of Nazareth (Graham Chapman) spends his life being mistaken for a messiah.",Terry Jones,"['Graham Chapman', 'John Cleese', '4 more credits»']","['Graham Chapman', 'John Cleese', 'Michael Palin']","['satire', 'british comedy', 'monty python', 'reference to jesus christ', 'spoof']","$4,000,000(estimated)","$20,206,622","$20,738,621","HandMade Films,Python (Monty) Pictures"
209,Million Dollar Baby,https://www.imdb.com/title/tt0405159/,2004,8.1,609087,PG-13,2h 12min,28 January 2005 (USA),"['Drama', 'Sport']",A determined woman works with a hardened boxing trainer to become a professional.,Clint Eastwood,"['Paul Haggis(screenplay)', 'F.X. Toole(stories)']","['Hilary Swank', 'Clint Eastwood', 'Morgan Freeman']","['boxing', 'determination', 'women boxing', 'death', 'euthanasia']","$30,000,000(estimated)","$100,492,203","$216,763,646","Warner Bros.,Lakeshore Entertainment,Malpaso Productions"
210,Platoon,https://www.imdb.com/title/tt0091763/,1986,8.1,365646,R,2h,6 February 1987 (USA),"['Drama', 'War']",A young soldier in Vietnam faces a moral crisis when confronted with the horrors of war and the duality of man.,Oliver Stone,['Oliver Stone'],"['Charlie Sheen', 'Tom Berenger', 'Willem Dafoe']","['vietnam war', 'gore', 'combat fatigue', 'gunfire', 'automatic weapon']","$6,000,000(estimated)","$138,530,565","$138,545,632","Hemdale,Cinema '84,Cinema 86"
211,Hachi: A Dog's Tale,https://www.imdb.com/title/tt1028532/,2009,8.1,237431,G,1h 33min,12 March 2010 (UK),"['Drama', 'Family']",A college professor bonds with an abandoned dog he takes into his home.,Lasse Hallström,"['Stephen P. Lindsey(screenplay)', 'Kaneto Shindô(motion picture ""Hachiko monogatari"")']","['Richard Gere', 'Joan Allen', 'Cary-Hiroyuki Tagawa']","['dog', 'japanese', 'loyalty', 'waiting', 'human animal relationship']","$16,000,000(estimated)",,"$46,749,646","Stage 6 Films,Inferno Distribution,Hachiko"
212,Ben-Hur,https://www.imdb.com/title/tt0052618/,1959,8.1,209569,G,3h 32min,29 January 1960 (Brazil),"['Adventure', 'Drama', 'History']","After a Jewish prince is betrayed and sent into slavery by a Roman friend, he regains his freedom and comes back for revenge.",William Wyler,"['Lew Wallace(novel) (as General Lew Wallace)', 'Karl Tunberg(screenplay)']","['Charlton Heston', 'Jack Hawkins', 'Stephen Boyd']","['homoerotic subtext', 'whip', 'person on fire', 'baldness', 'talking to a horse']","$15,000,000(estimated)","$74,422,622","$74,427,638",Metro-Goldwyn-Mayer (MGM)
213,Rush,https://www.imdb.com/title/tt1979320/,2013,8.1,411847,R,2h 3min,27 September 2013 (USA),"['Biography', 'Drama', 'Sport']",The merciless 1970s rivalry between Formula One rivalsJames HuntandNiki Lauda.,Ron Howard,['Peter Morgan'],"['Daniel Brühl', 'Chris Hemsworth', 'Olivia Wilde']","['formula 1', 'rivalry', '1970s', 'racecar driver', 'playboy']","$38,000,000(estimated)","$26,947,624","$96,983,009","Exclusive Media Group,Cross Creek Pictures,Imagine Entertainment"
214,The Passion of Joan of Arc,https://www.imdb.com/title/tt0019254/,1928,8.1,43597,Not Rated,1h 54min,25 October 1928 (France),"['Biography', 'Drama', 'History']","In 1431, Jeanne d'Arc is placed on trial on charges of heresy. The ecclesiastical jurists attempt to force Jeanne to recant her claims of holy visions.",Carl Theodor Dreyer(as Carl Th. Dreyer),"['Joseph Delteil', 'Carl Theodor Dreyer']","['Maria Falconetti', 'Eugene Silvain', 'André Berley']","['trial', 'joan of arc', 'close up scene', 'martyrdom', 'teenage girl']",,"$21,877","$21,877",Société générale des films
215,Logan,https://www.imdb.com/title/tt3315342/,2017,8.1,606229,R,2h 17min,3 March 2017 (USA),"['Action', 'Drama', 'Sci-Fi']","In a future where mutants are nearly extinct, an elderly and weary Logan leads a quiet life. But when Laura, a mutant child pursued by scientists, comes to him for help, he must get her to safety.",James Mangold,"['James Mangold(story by)', 'Scott Frank(screenplay by)', '2 more credits»']","['Hugh Jackman', 'Patrick Stewart', 'Dafne Keen']","['marvel comics', 'x men', 'superhero', 'mutant', 'north dakota']","$97,000,000(estimated)","$226,277,068","$619,021,436","Twentieth Century Fox,Marvel Entertainment,TSG Entertainment"
216,Andrei Rublev,https://www.imdb.com/title/tt0060107/,1966,8.2,42448,R,3h 25min,October 1973 (USA),"['Biography', 'Drama', 'History']","The life, times and afflictions of the fifteenth-century Russian iconographer St. Andrei Rublev.",Andrei Tarkovsky(as Andrey Tarkovskiy),"['Andrey Konchalovskiy(as Andrey Mikhalkov-Konchalovskiy)', 'Andrei Tarkovsky(as Andrey Tarkovskiy)']","['Anatoliy Solonitsyn', 'Ivan Lapikov', 'Nikolay Grinko']","['russian orthodox church', 'russia', 'painter', 'genius', 'silence']","RUR1,000,000(estimated)","$124,189","$145,491","Mosfilm,Tvorcheskoe Obedinienie Pisateley i Kinorabotnikov"
